,title,content,complete_tags,words_in_tags
0,secure otr protocol,using adium wondering secure believe uses aes-256 understand means default requests users exchange fingerprints encrypted conversations occur unique key used conversation logging turned depending user preference allow users suspect snooping breathe easier show,encryption aes otr,encryption aes otr
1,current known weaknesses/attacks quantum key distribution,writing paper implementation qkd future want know viable attacks bb84 protocol qkd general know photon number splitting spectroscopy case diode manufacturing heard solutions attacks missed,cryptanalysis attack quantum-cryptography key-distribution,cryptography cryptanalysis attack key quantum distribution
2,hill key space,key space set possible keys used generate key using number valid key describe given hill cipher block size k alphabet size p p prime many keys valid key hill cipher key k x k matrix elements getting size p alphabets understanding number possible keys p^ k^2 answer p^k-p^0 \times p^k-p^1 \times p^k-p^2 \times\cdots\times p^k-p^ k-1 believe related matrix inverse know determine edit reading key size hill cipher wiki got known something example shown case inverses co-factor .the number invertible n blocks alphabets n^ 1-1/2 1-1/2^ \cdots 1-1/2^ n 1-1/13 1-1/13^ \cdots 1-1/13^ n apply p prime p divide p^ k^2 result p^ k^2 1-p^ -1 1-p^ -2 \cdots 1-p^ -k different answer,keys prime-numbers classical-cipher hill-cipher,prime classical keys cipher numbers hill
3,digipass-like,sure famous algorithms problem knowledge field need lights si problem alice sends key x bob bob function given key x time generates key seconds valid seconds bob send recent alice consider key valid bob sens old alice consider key valid mathematical formulation functions e int e int x int time bool result int x int int time variable x functions variable time value changes function return true time argument generated argument d. people battle.net account recognize looking logic blizzard authentificator case authentificator bob question functions e d. guess tons possibilities famous algorithms used typical problem,authentication,authentication
4,ideal s-box,read linear cryptanalysis s-box ideal s-box ideal s-box random s-box words s-box bias input output bits read implementation s-box post understand s-box implementing lookup tables read post e-sushi answer non-linearity randomness aspects s-box trust fact chances you’ll manage create good s-box using current criteria minimal… minimal understand random ideal s-box lookup tables implement random s-box restriction limitation,s-boxes linear-cryptanalysis,boxes linear cryptanalysis
5,generate hash value using public key message,trying understand way signature chaining message saxena soh message passed user user combine signature create single signature message m. aggregated signature passed public key users signed message used prove message seen user chain signature protocol defined steps understand chainsign step message get different hash values h different values l know hash function takes message input yield hash value sequence public keys y1 y2 y3 ... .yi fed get different hash values add key message hash function get new digest mapping happening,hash hash-signature,hash signature
6,md5 ssl collision attack,want create fake certificate test purposes read http //marc-stevens.nl/p/hashclash/index.php project unable understand files put order create collision attack created ssl x.509 v3 md5 encryption file second,hash tls collision-resistance md5 openssl,tls hash openssl resistance collision md5
7,difference one-shot mpc protocol unbounded invocation multiple mpc protocols,paper pg section security continual leakage authors say remark weaker security notion achieved extended continual leakage mpc setting address setting n users perform one-shot mpc protocol engage unbounded number mpc protocols many functions mpc invocation adversary leaks \ell bits honest party’s internal state confused difference one-shot mpc protocol vs. unbounded number mpc protocols envisioning something mpc protocol leaks \ell bits honest party internal state mpc protocol leaks \ell new bits honest party internal state mpc protocol leaks \ell new bits honest party internal state ... mpc protocol k leaks \ell new bits honest party internal state total n honest parties total leakage n \times \ell k bits consider one-shot mpc protocol get n \times \ell bits leaked give example threshold cryptography say bunch parties compute decryption function end entire decryption key leaked time \ell bits leaked think \ell bits decryption key leaked authors considering unbounded number mpc protocols,multiparty-computation threshold-cryptography,threshold cryptography computation multiparty
8,cryptographic hash used cryptographic rng,say roll sided die times ~2^517 string results string numbers hash result sha-512 use result cryptographic purposes keys use hash result generate keys,hash key-derivation pseudo-random-generator,hash derivation generator random pseudo key
9,comparison complexity measures vs. security,assume want compare several cryptographic primitives say encryption schemes choose need consider several complexity measures key length encryption time decryption time etc order comparison fair primitives question provide level security example let consider rsa ecc ntru assume want cryptosystem secure passive adversary whose computational power limited operations passive adversary mean adversary limited chosen-plaintext attacks comparing public-key encryption schemes want know key length chosen scheme answer question consider complexity efficient attacks rsa ecc ntru turn requires great knowledge literature resource/survey website paper tool etc helps comparisons note website keylength.com helpful tool answer question reason keylength.com recommends minimum key length used different scenarios say symmetric asymmetric encryption leaves concrete schemes say ntru twofish serpent etc,encryption cryptanalysis resources key-size reference-request,reference encryption request cryptanalysis key resources size
10,twisted curves protocol,come twisted curves instance defined brainpool specifications f p -isomorphic regular f p equivalents brainpoolp256r1 isomorphic brainpoolp256t1 protocol make sense specify support twisted curves possible specify twisted curve oid f p equivalent using twisted curve representation curve performance benefits regular representation twisted curve representation used security analysis curve,cryptanalysis elliptic-curves,curves elliptic cryptanalysis
11,difference long term key session keys,studying secret key cryptography come terms long-term key session key difference kinds keys,encryption symmetric keys key-exchange,symmetric encryption keys key exchange
12,encrypting private public keys produce result,let say e n encrypt example m=15 get m_1 m^e=15 \mod \qquad m_2 =m^d= \mod rsa bad question prompted answer hash salt signing work,rsa modular-arithmetic,modular rsa arithmetic
13,given unencrypted encrypted data aes-gcm possible calculate chiper key aes-gcm,sorry simple curiosity given unencrypted encrypted data aes-gcm possible calculate chiper key aes-gcm,aes,aes
14,causes first block aes decryption garbled correct iv,attempting duplicate wireshark packet capture decryption tls http session control private key server cipher suite number tls_rsa_aes_128_cbc_sha wrote utility takes packet captures using libpcap match logs wireshark say terms mac keys write keys iv printing binary data hex characters confirm keyblock ciphertext identical wireshark log display perform following decryption steps ... decrypt pre_master_secret generate keyblock ... initialize cipher context evp_cipher_ctx_init myevp evp_cipherinit_ex myevp cipher null wkey iv logerror evp_cipherinit_ex err_error_string err_get_error nul dec evp_decryptupdate myevp outb outlen data datalen totalcount += outlen dec logerror evp_decryptupdate err_error_string err_get_error nul dec blocklen dec evp_decryptfinal_ex myevp outb totalcount outlen totalcount += outlen ... get padding last bit outb remove padding outb plaintext ... remove mac plaintext resultant plaintext get identical wireshark spits logs execption first block decrypted data know general caused correct initialization vector begin decryption computed keyblock values seem correct say jive wireshark spitting first blocks wireshark shows ... ... mine plaintext_update e1 a2 f4 b3 d1 c4 f4 d8 c9 ... first block verify decryption step context correct original iv value current logdata evp myevp- evp.oiv myevp- evp.cipher- iv_len logdata evp iv myevp- evp.iv myevp- evp.cipher- iv_len wireshark client write iv c0 c5 dc mine evp iv c0 c5 dc likewise keys think need illustrate values remaining blocks decrypt checked make sure first block gzipped whatever checked wireshark code equivalent stuff libgpgcrypt anybody seen anything,encryption aes tls cbc,tls encryption aes cbc
15,additive homomorphic encryption supports exponentation,example say numbers b. partial homomorphic encryption scheme allows compute a-b ^2 ciphertexts b round trips,encryption elliptic-curves homomorphic-encryption elgamal-encryption probabilistic-encryption,elgamal encryption homomorphic curves elliptic probabilistic
16,generate rsa public/private key pair passphrase sufficient entropy,possible generate public/private rsa key pairs passphrases giving key generating algorithm data made key-stretching passphrase source random data sufficient strong extra credit possible generate key pair public private passphrase public key generated public passphrasse private key use trying deal difficulties using rsa keys pasted/exchanged things,rsa public-key key-derivation,derivation rsa key public
17,lightweight hash function,researching lightweight hash functions got related questions standard requirement hash function general considered lightweight said photon hash function lightweight,one-way-function,function way
18,rsa cryptosytsem choosing e,using rsa crytposytem p q hence n \phi understand get e gcd e \phi =1 many thanks,rsa,rsa
19,xoring header sha512-hash secure,writing application encrypts text several times stores result result looks complete random bytes add random bytes end let program know real encrypted text ends put header beginning file header consists bytes h header h_0 h_1 magic numbers chosen numbers check file h_2 h_3 h_4 h_5 show length text 32-bit integer h_6 h_7 random fill header bytes make header look random bytes program find files xor header-bytes sha512-hash password hash h_i h_i s_i s_ i+8 s_ i+16 s_ i+24 s_ i+32 s_ i+40 s_ i+48 s_ i+56 makes file look random bytes think reveals information sha512-hash password least bytes header known others predicted looking size file help attacker find password rainbow table magic numbers help attacker eliminate password-hashes magic numbers known hashes xor magic numbers bytes given file question way securing header insecure think prevent know prefer method xoring hashing,encryption hash sha-512,encryption hash sha
20,information-theoretic bound leakage timing measurement,looking information-theoretic bound leakage timing measurement assuming attacker wants leak black box secret key k bits injected black box written black box code read key act craft code point choosing duration function performed black box n spaced durations t_j=t_0+j/ n-1 j n t_j units clock period t_0 known measure duration function uncertainty u according distribution u |u| stated execution function looking tight upper number timing measurements leak whole key sure k remains secret execution leaks \log_2 n bit worth information way timing measurement least \lceil k/\log_2 n \rceil timing measurements required extract key sole mean bound reached attacker \big\lceil\log_2\big \lceil k/\log_2 \rceil\big \big\rceil bits permanent storage black box survive function execution sketch write key k base n permanent storage used counter telling digit k leaked update realize bound \lceil k/\log_2 n \rceil measurements applies attacker choose input black box code act makes q1 q2 less relevant q1 attacker code permanent storage true random number generator internal blackbox appropriate way characterize number measurements required leak key q2 situation q1 attacker obtains addition timing measurement large random input output black box available attacker code q3 attacker uncertainty distribution u becomes significant consider u discrete uniform distribution m-1 u gaussian something u sum discrete uniform distribution m-1 rationale true goal reached answer q3 conditions q2 assessing demonstrable effectiveness countermeasure timing attacks smart cards assumed running consisting inserting random sensitive operation q3 hypothesis attacker written code course worst case scenario crafted order obtain upper bound leakage lower number measurements necessary q2 asked real situation attacker write code reasonable believe equivalent permanent storage usable attacker input output deterministic effect timing q1 introduction q2 data dependency,side-channel-attack,attack side channel
21,help understanding basic franklin-reiter related message attack,trying understand attack basic level set following basic scenario let public encryption exponent e let p arbitrary known padding couple characters suppose intercepted encrypted messages c_1 c_2 bob alice c_1 \equiv m_1^3 mod n c_2 \equiv m_1 p ^3 mod n answer question understanding find determine gcd m_1^3 c_1 m_1 p ^3-c_2 right go using euclidean algorithm look polynomials familiar finding gcd polynomials using ea seem figure apply,rsa,rsa
22,generating child keys hill climb algorithm,"little pet project writing code little cryptanalysis starting something simple created hill climbing algorithm solving simple substitution start generating parent key shuffling letters a-z first iteration generating child key swapping characters parent key subsequent iteration shuffling characters previous iteration key approach works seems inefficient randomness seems generate key attempt solution question better solution generating child keys random things considered tried memorizing previous keys checking new random key tried means shuffling characters swap 1-2 1-3 1-4 ... 2-3,2-4 ... etc feels brute force strike making algorithm less efficient ie overhead outweighs gain made using random chance particular thoughts edit comments pointed problem facing generate better child keys avoid local maximum relevant details algorithm follows scoring based sum log10 probability quadgrams running algorithm iterations provided better score running entire thing tries produced better score",cryptanalysis,cryptanalysis
23,confusion regarding computing multiplicative inverse modulo p,doubt please rectify confusion regarding problem concreteness assume g=2 p=11 a=6 x=9 g^a \bmod p \bmod x g^x \bmod p \bmod c a^x \bmod p \bmod find x i.e g^x using c x c^ a^ -1 \bmod p -1 \bmod \bmod answer x x x \neq x problem mistake,diffie-hellman number-theory group-theory,diffie hellman number group theory
24,carmichael number factoring,unsure right forum question try task im faced implement poly-time algorithm finds nontrivial factor carmichael number many resources web states easy explanation miller-rabbin exits nontrivial square root found used find factor carmichael number x^2 \equiv x+1 x-1 \equiv0\ mod\ n carmichael number want factor hence factors found using \gcd x+1 \gcd x-1 n correct due problems strong liars cases miss factors major problem miller-rabbin tests passes composites probability correct say chances finding factor kind regards,number-theory factorization,number factorization theory
25,achieving 256-bit encryption strength hmac-sha1,interested theoretical consideration bit strength encryption key precursor assume given environment follows encryption aes-256 b. key derivation function hmac-sha1 b1 salt strength bit chars random hex string b2 iteration count objective achieve bit encryption strength based environment achieve true 256-bit total strength environment stated randomness provided sha1 pbkdf2 standard bit rsa document pkcs v2.0 password-based cryptography standard march length derived key unbounded maximum effective search space derived key limited structure underlying pseudorandom function ... derived key consisting several pseudorandom function outputs produced key effective search space derived key bits specific limitation key sizes depends details hmac construction assume conservative effective search space limited bits key questions expect 160-bit encryption strength existing environment feed result pbkdf2 output skein 512-512 hash function left-most hex =244 bit characters output encryption key sought-after 256-bit total encryption strength added bit extra strength due iteration count calculations,aes passwords key-derivation,aes passwords derivation key
26,way calculate public exponent e rsa,"learning rsa classes given problem p q done following steps \cdot \phi 5-1 \cdot know find e find integer co-prime \phi \phi \gcd e,40 algorithm use hand give e know numerous values method shown enumerate prime find first divisible totient \phi assume give small numbers exam trial error time consuming understand use extended euclids algorithm find inverse e provided know e struggle finding e",rsa prime-numbers,prime rsa numbers
27,rsa key generation public exponent big,writing paper rsa self-chosen subject writing key-generation rsa problem finding public exponent e. chosen q determined modulus n p ⋅ q phi n p-1 q-1 bothers try generate public exponent e using cryptool given parameters gives e thought less phi n p-1 q-1 according source ok break rule cryptool faulty,rsa public-key,rsa key public
28,load-balance https traffic based tls sni,possible snoop https traffic detect tls sni attempted used client redirect stream connection as-is many different upstreams requires https order connect certificate known,tls key-exchange initialization-vector standards,tls exchange initialization standards vector key
29,calculating amount time brute forcing ciphertext depending size key,graphic design student information graphic project chosen topic history encryption security level developed centuries it’s information graphic make people aware encryption importance times see news nsa et taking several encryption concepts caesar cipher jefferson wheel something modern aes calculate brute-force time maximum key size main point want show security level grew size grew problem wanted calculate key size research key sizes specific encryption concepts addition wanted calculate brute force time attack encryption find long takes crack individual encryption know simple approach wanted keep simple possible i’m sure calculated appreciate someone explain understand example brute-force computer found www.orange.co.jp/~masaki/rc572/ratej.php keys/sec set brute-force pc vs. pc using specific encryption everything calculated wolframalpha.com caesar cipher got possible combinations characters wikipedia says means time seconds ns enigma wikipedia says it’s long possible keys keys/2096204400 keys/s average gregorian years calculations correct,encryption brute-force-attack,encryption attack force brute
30,necessary encrypt nonce cryptographic communication,server client pre-shared key k. assuming pre-shared key safe nobody server/client encrypt/decrypt client sends nonce n server server sends message encrypted form aes_cbc_encrypt m+n k iv client client verify replay attack trying send expired message necessary client send encrypted form aes_cbc_encrypt n k iv ok send n clear n 16-byte array m+n means concatenation n,encryption nonce,nonce encryption
31,algebraic cryptanalysis public-key schemes,book algebraic cryptanalysis bard g.v springer speaks transforming symmetric scheme system polynomial equations solving equations break scheme way asymmetric schemes impossible techniques kind scheme,public-key cryptanalysis algebraic-attack,algebraic attack public key cryptanalysis
32,vectorized fast hardware-accelerated aes-gcm,understand norx gets cpb unoptimized implementation parallelized 4-way simd expect cpb performance good aes-gcm hardware something wrong assesment parallel better choice speed chacha20-poly1305 sequential versions primary recommendations questions w.r.t keyak cpb 2-way parallelism cpb 4-way parallelism,aes chacha norx keyak,aes norx keyak chacha
33,n way collision hashes,collision h a_1 h a_2 number queries t^ \log_2 length hash output number queries requried find n -collision h a_1 h a_2 ... .. h a_n,hash collision-resistance birthday-attack,collision attack birthday hash resistance
34,prng algorithm allows switch states calling next,need function following interface getrandombytes uint128 seed uint64 state uint16 bytecount consecutive calls seed state give results algorithm look,random-number-generator,random number generator
35,gpg encryption data length different text data bytes,using gpg2 base64 commands algorithm input encrypted bytes input data fixed length bytes current problem run gpg command times encrypted data bytes byes,pgp,pgp
36,perform frequency analysis substitution cipher using base64 alphabet,let imagine cipher works following plaintext encoded base64 characters encoded substituted shuffled character set a-z 0-9 shuffled alphabet essence key complex secure ... wanted frequency analysis example runforyourlife encoded base64 ulvork9swu9vukxjrku= character set shuffled final cryptext look something xv24dyg9qxg2xyg6dyxf key yhac5btoweyvbxcpvuomjldg8p1jhn3zisi67srk4e_d9-x2qrqmnlkwuaft0g=zf shuffled version abcdefghijklmnopqrstuvwxyzabcdefghijklmnopqrstuvwxyz0123456789-_= let assume character set subsequent messages order ie key re-used bytes split resulting different character units correspond frequency analysis feasible encoding plaintext way encryption add form security question pertains longer messages example short sort real analysis,encryption substitution-cipher encoding frequency-analysis,encoding encryption analysis cipher frequency substitution
37,modify data protected crc16,bytes crc16 know want change byte known value x value fix crc16 valid knowing bytes 50-100. possible tcp checksum addition crc16 polynomial possible,mac crc,crc mac
38,interactive assumptions falsifiable,someone explain interactive assumption falsifiable misunderstanding statement means non-interactive assumption interactive zero amount interaction context isolated paragraph intro paper due series criticisms starting cgh98 practical schemes proposed proved secure standard model i.e. random oracles falsifiable non-interactive assumptions paper mentions define term falsifiable,encryption,encryption
39,rsa keys safety given key-length different signing vs encryption,wondering considerations key-length different thinking signing vs encryption reason safter use smaller keys signing interesting,rsa key-size,rsa key size
40,notation hash function identity-based encryption,h \rightarrow z_ p h \rightarrow z_ p h \rightarrow g_ h \rightarrow g_ difference meaning z_ p z_ p g_ g_,identity-based-encryption,encryption based identity
41,low entropy plaintext compressible,comes following discussion colleague plaintext file plain consists lines work play ... size mb compressed encrypt original aes-128-cbc -in plain plain.enc plain.enc bigger original expect compress encrypted copy gzip plain.enc observe compressed copy larger plain.enc assuming entropy original file order bits corresponding ciphertext incompressable intuitive notion entropy string minimal number bits required produce string string mb text generated 1000-bit entropy string encrypted aes implementation thousand bits few-hundred bit key entropy cipher text sum entropies strings procedures generate question intuitive notion wrong extended low-entropy file orders magnitude larger begin observe compressibility ciphertext,encryption entropy compression,encryption compression
42,feed-forward mechanism used hash functions,compression function sha-1 used davies-meyer mode adds input chaining values final step message block iv used input next step previous block output specified merkle-damgard used values fed last round compression function removing feed-forward part i.e. final step input value added result get final output make hash function insecure fact compression function satisfy desired randomness properties permutation fixed message,hash,hash
43,encrypting files known headers,file known lengthy header e.g xml excel file render encrypted file susceptible known plain text attack words x bytes decrypted text known weaken encryption remaining data,encryption known-plaintext-attack,known encryption plaintext attack
44,best plain cryptography method use computer,best cryptography method use computer list current options available used use computer system/electronic device like identify types cryptography techniques used small amount hand written plain text numbers symbols characters hard implement easy implement like brief description e.g types cipher's different types algorithm range security low high etc,algorithm-design encryption security-definition,encryption security design algorithm definition
45,symmetry finite cyclic groups z/pz ∗,known \leq \leq \frac p − g^ i+ p−1 /2 g^ i−1+ p−1 /2 − g^i g^ i−1 \pmod p whilst working finite cyclic group prime moduli z/pz ^* given g primitive root p. property used improve trial multiplication algorithm see http //eprint.iacr.org/2014/291,group-theory,group theory
46,mouse movement coordinates useful seed rng,good use mouse movement 64-bit random seed pseudorandom generator aes counter mode need get x coordinates mouse movement,random-number-generator randomness,randomness random number generator
