,title,content,complete_tags,words_in_tags
127,comprehensive alternatives rsa,wished comprehensive alternative rsa say comprehensive wonder encryption digital signature rsa alternatives,encryption rsa public-key,encryption rsa key public
128,choose padding mode aes,depending framework using various padding modes used aes encryption example .net choose pkcs7 iso10126 ansix923 zeros none understand encryptor decryptor need use mode interoperable considerations choosing padding mode exception matter considered secure others,encryption block-cipher symmetric padding,symmetric encryption cipher padding block
129,changing plaintext encryption rsa,rsa crypto scheme message x plaintext encrypted produce ciphertext computing x^e \bmod n course means x numeric value work assuming found tables ascii plaintext x single character message larger parts encrypted examples seen expanded x given small numeric value exampes interested understand x practise,rsa,rsa
130,requested encrypt data aes256 digital certification timestamped,job tasked gov encrypt data send law says title need aes256 thing data important point change mind enforce full specs crypto wanted ask clarifications ideas learned timestamping digital certification assuming ssl things buy verizon certify claim create ssl certificate apache gather rsa aes raw data timestamping timestamped data aes256 enc tstamp data rsa private key result send gov gov receives result uses rsa public key aes timestamp check thing certificate supposed online something public key public gov learn fine aes read symmetric agree password secret right give password use request point timestamp require agree going timestamp data send knew public key use decoding timestamp salts add data passwords sure add gov assume end trouble secret aes passwords going leaked point someone gov future unknown company used harm company/me forging fake data trying think paranoid end salting everything whenever done correct encryption pipeline salt append data decryption pipeline add salt append data append timestamper,encryption rsa aes timestamping,encryption aes timestamping rsa
131,hash decrypts key key decrypts cipher ...,noticed couple pieces encryption software truecrypt use hash password key block cipher generate random key use encrypt data xor key hash password store result encrypted file header see useful perspective wanting different keys different files password think reason hashes weak block cipher keys missing something additional security considerations think kind mechanism mechanism superior using keyed hmac hashes file contains key,encryption hash passwords keys file-encryption,keys encryption passwords hash file
132,pseudocode constant time modular exponentiation,looking implement modular exponentiation rsa constant time examples found mathematical descriptions operations references descriptions psuedo-code understandable implementable someone much math background,rsa implementation reference-request modular-arithmetic,reference implementation request rsa modular arithmetic
133,expect find collision hash function \sqrt n hashes,get intuitive understanding \frac n number bits key consists,hash collision-resistance birthday-attack,collision attack birthday hash resistance
134,matsui linear attack des p box,trying understand matsui linear attack des something understand paper paper say =12 ok say x f_5 x k =k problem indices come supposed output bits s5 p box bits take p box wikipedia true,linear-cryptanalysis,linear cryptanalysis
135,purpose expanding shrinking sha-1,purpose expanding shrinking sha-1 serves security purposes,hash cryptanalysis sha-1,sha hash cryptanalysis
136,proof counter mode operation cbc mode cpa secure pseudorandom permutations,know counter mode cpa secure used block ciphers modeled random permutations use pseudo-random permutations cpa secure proof cbc mode used block ciphers modeled pseudo-random permutations cpa secure proof,cbc,cbc
137,happens entropy hashing,happens entropy hashing suppose key entropy k entropy k increased hashing key,hash entropy,entropy hash
138,guarantee plaintext coprime rsa,specifications rsa state p^ \phi n \equiv ~mod~n p n coprime p plaintext n product suitable primes x_1 x_2 question guarantee p plaintext coprime n thank advance,encryption rsa public-key cryptanalysis,encryption cryptanalysis rsa key public
139,creating spn cipher chacha20 salsa20 double round function,given chacha20 building blocks used construct hash function double round function chacha20 salsa20 used construct secure sp-network cipher double round function serves permutation function 512-bit round keys xored permuted result round f \rightarrow double round function g \rightarrow inverse f r rk x =f x \oplus rk single encryption round rk =g \oplus rk single decryption round,symmetric salsa20 chacha,symmetric chacha salsa20
140,hmac sha256 vs rsa sha256 use,salesforce announced moving hmac sha256 rsa sha256 make move technical factors hmac easy break https //login.salesforce.com/help/pdfs/en/salesforce_summer13_release_notes.pdf ps security expert,rsa hmac,rsa hmac
141,basic encryption decryption related question,started studying cryptography got interested subject got doubt studying encryption scheme encrypt message change ciphertext ciphertext available attacker attacker modifies ciphertext sends receiver decrypt message right..,encryption,encryption
142,reusing pgp key generating ssl certificate authority,make sense reuse keys pgp gnupg gpg keyblock generating ssl certificate authority toy web services mine ideal world people keypair trustworthy hardware device use certify everything e.g ssl certificate authority opposed generating rsa key openssl advised online tutorial possible benefits know afaiu different story,pgp certificates openssl,certificates openssl pgp
143,dual_ec_drbg openssl mac,much info related anyone know default csprng dual_ec_drbg wiki clear… related first question anyone experience openssl mac changing default csprng,openssl dual-ec-drbg,ec drbg openssl dual
144,output linear shift register given plaintext intial state,given initial state s_0 plaintext p need find ciphertext method solve taught coursework information found online seem anyone explain steps needed solve,random-number-generator stream-cipher,stream cipher random number generator
145,flaw ecc signature scheme,found following work internet ecc-based blind signature scheme paper claims ecdsa blind signature seems scheme flaw process describe standard requester blinds message using key sends blinded message signer signer signs message resulting pair r sent requester requester unblinds component r component published unchanged seems logical publishing r way came allow signer track transactions keeping database issued r tokens missing something,elliptic-curves blind-signature digital-cash,digital cash curves elliptic signature
146,ok use hash key nonce aes gcm,see immediate risk using hash key nonce aes gcm something overlooking,aes nonce,nonce aes
147,tag length used eax mac,eax flexible regard length calculated call tag mac value eax paper well documentations avoid suggesting value length mac anything take consideration setting value length proportional collision resistance subtle consequences depending mac length,modes-of-operation mac authenticated-encryption collision-resistance eax,authenticated modes eax encryption resistance collision operation
148,randomize encrypted data hide data source,small amount data typ byte channel eavesdropped time behaviour way data changes protected encrypt using xor bytes key c x k means c m. observing interesting decrypt actual data cipher reveals enough information data source observing data encrypted ... ... look t=0 t=1 t=2 t=3 ... t=0 t=1 t=2 t=3 data lineary increases variable increment long time period changes fixed average value change long period time guessable much effort clear data little change randomized encryption constraints security obscurity algorithm known data broadcasted source updated defined interval time period eavesdropper see data get read peer receiver/reader miss message update able sync message loss acceptable receiver peers rely stable tamper-free timebase cpu power memory requirement limited data behaviour seen unconfidential see option suitable broadcasting active read combine data pseudo random factor derived confidential iv known sides combination encrypted using confidential key look mins update interval e.g mins unconfidential k key confidential iv lfsr seed confidential r initial rounds unconfidential r lfsr round counter n iv pseudo noise lfsr def hide lfsr n return x def enc return x k initialize r r n lfsr n r r true r r read_four_byte_message feed broadcasting store retrieval enc hide r sleep clear eavesdropper brute force probe ivs cycled r times lfsr xor cipher know message change update intervals questions missed attacking vectors anything improve security increasing iv key lengths please guide basics learn,randomness,randomness
149,aes secure key generation storage,client-server application transferring data components secure way use aes algorithm cbc mode transfer data file scenario client ask data file plaintext server takes request encrypt data iv/key pair sends encrypted data client client stores data encrypted client user application reason client open files read data offline mode server application .net based client delphi need secret key generation mechanism secure changeable client server something related current user etc experienced cryptography waiting experienced advices thanks advance edit try explain problem details client application opening files format say files downloaded database server authenticated user download files authenticated user download files copied computers disks files contain worked models say models need encrypted case client sqlite database need updated send scripts client encrypted way client decrypts executes saves values encrypted work asked question proper way key generation mean create mechanism exchange data key storage mechnaism creates key runtime sides using userids licence keys etc ... user information client server hope explain,aes,aes
150,user-specified pbkdf2 password salt iterations limits,decentralized login user left select password salt iterations minimums enforced words none stored implementation standard login authentication guidelines 4-digit pin enforced produce uncrackable combinations login username password substituted pbkdf2 password salt vice versa pin number iterations less pbkdf2 scheme tool user generate 32-byte signing keys user memory storage conforming key course accepted overall implementation use tool help save standard username/password rules implemented minimums measure length quantity and/or variety special characters placed pbkdf2 password/salt combination,keys pbkdf-2,keys pbkdf
151,use cribs,looking incorporate crib usage breaking ciphers unknown enciphering schemes least gleam information seems big hurdle looking references incorporating cribs decryption schemes allow clarify crib mean word set words suspect message example suppose suspect word parachute words enciphered question good question try give weight literature read big gap elementary cryptanalysis modern cryptanalysis feel modern cryptanalysis focuses big-power public-key schemes easy hard break middle many schemes wwii pacific forces broke japanese naval encryption learned many different classical encryption decryption techniques unfamiliar approach getting information set messages based fact words appear message sort basic idea went years military intelligence read relied cribs occasion giving certain pieces information japanese diplomats messages contain known words mean alienate demonize japan us-japan relations happens big example suspect many read codebreakers beginning book suspect many familiar idea end ask anyone refer references use cribs extract information unknown scheme helen gaines book cryptanalysis uses many cribs book underlying idea scheme known course case final note aspect paulo marques answer deleted find deeply troubling say schemes built strong knows scheme mean scheme strong information gotten scheme schemes strong attempt break anything know case recent meta post paulo ebermann asserted belief se limit modern cryptography minority please let know search,cryptanalysis reference-request,request reference cryptanalysis
152,random value element picked \frac p-1 \frac p-1 ^2 probability,let \mathbb f _p finite field p large prime number e.g 256-bit know probability element picked field p-1 say element picked uniformly random question security context say element uniformly probability \frac p-1 \frac p-1 ^2,cryptanalysis provable-security,provable security cryptanalysis
153,encrypted sdcard readable/decryptable desktop machine,sdcard android phone using built-in encryption software phone dies reason able using pin/password access data desktops os x windows linux,encryption,encryption
154,file random access,programmer familiar c/c++ python got assignment team asking work projects need make small program encrypt large file using symmetric key encryption achieve using aes128 aes256 crt mode catch small part file given location bytes beginning file able decrypt piece thought cutting file multiple pieces applying separate generated key issue regarding said part size cut like know lapping blocks handle idea working slicing bytes calculate number bytes last slice get bytes generate random padding bytes beginning decrypt remove bytes case multiple slices overlap split method repeated like know sensible better cipher algorithm allows ps files image files document files know basics cryptography,aes reference-request modes-of-operation file-encryption,aes modes reference encryption request file operation
155,constructing secure key exchange protocol,\pi= gen enc dec let secure public-key encryption scheme security parameter n message space plaintext \lbrace \rbrace^n using \pi want construct key exchange protocol \theta rounds i.e alice bob secure eavesdroppers possible prove course assumption security \pi example diffie–hellman key exchange protocol fits exercise somethink know generalize p.s key alice bob establish \in \lbrace \rbrace^n,key-exchange semantic-security,security semantic key exchange
156,secrecy pseudorandom functions,let h_2 keyed hash functions e.g h_i x sha_ s_i||x pseudorandom s_1 s_2 let s_n h_1^k s_0 k_n h_2 s_n s_0 secret pseudorandomly chosen distribution using k_n sequence forward-secure keys secure i.e. forgetting s_n changing k_ n+1 noting h_i known attacker seems able distinguish k_n random knowing s_ n+1 k_j j h_i modeled random oracles seems attackers require \omega oracle requests average k key length h_i lose factor reduction attacker guesses disjoint s_j j n attacker gains information intuition correct get better bound \omega good given using sha-256 128-bit security level,hash random-oracle-model forward-secrecy,oracle model random hash secrecy
157,bit independence sha-2 hashes secure,know bit independence good sha2 function output secure example sha512 secretkeynonce256bit 32ytes used message encryption key b next 16bytes/128bits used authentication hmac key message c next 16bytes/128bits used access code non-secret known message carrier user provides code given encrypted message carrier knowledge c yield insight b better use c2=first bits sha256 c weakness extra sha prevent secretkey derived crummy password case c valuable attempted brute-like password guessing tried password produces c likely password correct produce correct people mention hmac weaker side think collision resistance sufficient application,sha-2,sha
158,gpg par2 error correction data plain archive compromise security,following scenario archives compressed hundreds mib size gpg encrypt archives binary ascii armor par2 create error correction data question encrypted archive plain archive error correction data archive compromise security gpg-encrypted data error correction data created encryption stored encrypted archive encrypted archive encrypted archive error correction data alternative better calculate error correction data encrypted data encryption way affect security common sense tells know rationale need archive data question want make sure restored gets damaged way course compromising security,encryption pgp,encryption pgp
159,journals read order keep date interesting research,love suggestions crypto.stack academic journals read range introductory advanced long free requires access fees feel free edit question looking specific fields,encryption,encryption
160,public key reverse encryption algorithm known,reading getting end-to-end encryption reading notice something want send message cell cell b public key pass message algorithm send cell b question knowing public key gives power reverse engineer message sent possible knowing algorithm created code code get original information,encryption public-key,encryption public key
161,compute secret form \mathsf s=sk\cdot g^a,standard way compute secrets shares t+1 combination n constructs secret \mathsf s=sk\cdot g^a generator \mathsf g \in \mathbb z _p \mathsf sk chosen random \mathbb z _p,secret-sharing shamir-secret-sharing,secret sharing shamir
162,aes gcm implementation c,implementing cipher gcm mode c questions code based code found reference copy relevant portions http //blogs.msdn.com/b/shawnfa/archive/2009/03/17/authenticated-symmetric-encryption-in-net.aspx difficulty understand additional authenticated data aad gcm implementation aad consist b aad stored c detrimental operation cipher leave aad blank // authenticated data becomes part authentication tag generated // encryption part ciphertext decrypting // ciphertext authenticated data produced // authenticated data match encryption decryption time // authentication tag validate aes.authenticateddata encoding.utf8.getbytes additional authenticated data understand supposed utilize tag property need store tag created b data authentication portion gcm implemented tag encryptor.gettag certain retrieve iv nonce encrypted data code referencing makes call aes.iv getnonce removing bytes encrypted data someone able answer questions surprised worth shot thanks,encryption aes gcm,encryption aes gcm
163,rsa key size size private key exponent,implemented key pair generation scheme rsa algorithm taken length private key exponent rsa key size got know rsa key size size modulus n wrong take rsa key size size private key exponent generate private key bits increase size private key exponent modulus n,rsa key-size,rsa key size
164,useful modern electronic communication,seen time time questions various otp schemes otp i.e stream cipher schemes common otp troubles appear extend size generated key generate key get key material recipient electronic communication storage encryption appears scheme impossible make work works benefits clear requirement key needs size input seems unbearable many modern use cases encryption practice useful modern cryptography component used proofs example ideal encryption algorithm i.e possible base otp provide information theoretic strength hashing authentication etc,one-time-pad,pad time
165,rsa bit key benchmark,benchmark rsa operations computer want know 4096-bit long keys general computers many encryptions decryptions possible second benchmarks found 1024- 2048-bit keys,rsa performance,performance rsa
166,composing inverting symmetric encryption keys,using symmetric encryption algorithm e message users send e recipient recipient compute e^ -1 e =m retrieve message symmetric encryption algorithms secure send e^ -1 recipient compute e e^ -1 =m suppose symmetric keys k l encrypt compute k l =m secure encryption k l compute new key kl kl =k l know xor properties used block question exist secure symmetric algorithms properties used multiple blocks,encryption symmetric,symmetric encryption
167,leakage secure party computation,trying understand garbled circuit based approach secure party computation much leakage classic millionaire problem comparison circuit used imagine want arithmetic operation addition multiplication revealing individual wealth need reveal individual wealth using garbled circuits approach running protocol addition circuit sum total wealth reveal millionaire wealth simple difference total wealth self wealth secure party computation recommended class circuits,multiparty-computation garbled-circuits,garbled circuits computation multiparty
168,possible correct exponent rsa public key altered,possible change exponent rsa public key,rsa,rsa
169,conditions perfect secrecy vigenere cipher,please forgive ignorance major looked cryptography seems stupid question quiz attempting head wondering course credit receiving certification passing interest attempted question multiple times getting wrong understand question consider vigenere cipher lowercase english alphabet key length following message spaces scheme secret check apply set 7-character strings lowercase english letters set strings lowercase english letters containing characters set 6-character strings lowercase english letters set 5-character strings lowercase english letters know getting punished combinations available due criteria point guessing learning annoyed quiz following considered correct answer aspect question secret length key equal length messages message space seems answer wrong wrong key individual member strings message space length messages message space combined i.e turning time pad key length total message space go breaking question arrive answer sort mathematical reasoning taking blind shots description introduced vigenère cipher presented following way said key string letters english alphabet plaintext consist letters english alphabet encrypt given plaintext key shift character plaintext amount dictated next character key view simple addition modular letters english key shorter plaintext wrap key needed decryption reverses process,vigenere,
170,public key encryption secrecy,known non-trivial system secure public key encryption time function computable pubkey privkey pairs generated time privkey encrypting pubkey encryptor chooses value appropriate range given privkey0 time privkey0 appropriate range \qquad compute privkey1 time privkey1 given privkey generated original privkey \qquad applications message encrypted pubkey \qquad time privkey decrypt message given privkey generated original privkey \qquad applications messgae encrypted pubkey \qquad time privkey infeasible learn anything message trivial system generating keys privkey paired chosen state forward-secure pseudo-random number generator pubkey list public keys ordinary pke system generated using pseudo-random output state time function taking first entry pair range values non-negative integers less number ordinary public keys list encryption pubkey pair ordinary encryption t'th ordinary public key list step updating changing first part privkey changing state generating first ordinary public keys step decryption using known state regenerate ordinary private key t'th ordinary public key list using private key decrypt second part encrypted message problem trivial system size pubkey grows desired size range values,public-key,public key
171,effect salt attacks hashes fundamental properties,interested analyzing adding salt hashed passwords affects types attacks use types attacks hashes follows hashed output looking matching input pre-image input output want find matching input second pre-image input want find output collision thought addition salt output affect ability perform attack reliant output find matching input salt chances finding matching input becomes impossible check output possible salt attack known using rainbow table,hash salt rainbow-table,salt hash table rainbow
172,making prfs prgs,possible take prg g k stretch n\cdot2^n read output table prf f k input output size n sounds possible read done,pseudo-random-generator pseudo-random-function,function random pseudo generator
173,hmac assumptions cryptographic hash,according wikipedia cryptographic hash function following properties pre-image resistance given h difficult find message h h second pre-image resistance given m_1 difficult find m_2 m_1 \ne m_2 h m_1 h m_2 collision resistance difficult find distinct messages m_1 m_2 h m_1 h m_2 assuming h hash function following function h — understanding — hash function h m_0 || h m_1||m_2||\dots||m_k m_i th byte h leaks byte leaking byte find pre-image collisions looking hmac wikipedia says takes hash function maker assumptions hash function taking hash function h let leak \operatorname len key bytes long message hmac hmac insecure everybody sees key h cryptographic hash function — case question h cryptographic hash function building hmac requires additional assumptions additional assumptions fulfilled hash function secure hmac properties imply properties see pbkdf2 takes prf hmac-sha256 secure hmac given hash function properties prf understanding questions assumptions hmac,hash hmac,hash hmac
