,title,content,complete_tags,words_in_tags
259,practical uses machine learning cryptography,go study masters machine learning data mining high performance computing become interested cryptography taking dan boneh cryptography course coursera.com wondering practical applications machine learning cryptography quick google search seem much wondering someone knows something first impression machine learning techniques used learn inverse function cipher passphrase given enough plaintext/ciphertext pairs sure capable things neural networks learning functions separable,encryption cryptanalysis,encryption cryptanalysis
260,non-commutitive nonassociative algebraic structures cryptography,cryptographic algorithms primitives developed studied make use non-commutative non-associative algebraic structures quaternion integers octonion integers seems many structures preserve things make useful cryptography trapdoor nature multiplication example removing tools used attack symmetries exploited commutativity associativity several structures non-commutative non-associative many features unique factorization domains hurwitz quaternions integers studied conway smith surprise learn structures similar properties enough integers familiar broken symmetries make resistant cryptanalytic attacks obvious utility think using quaternion octonion based unique factorization domains rsa many cryptographic systems use objects integers see extended alternative structures downside see hidden congruence relation able exploited exist integers cryptosystems use alternatives integers,number-theory,number theory
261,openssl logs showing keyblock length bytes bytes,decrypting tls encrypted data wireshark using openssl tls1.0 version tls logs provides complete key block size bytes.now moved version key block size bytes only.anybody please help ... thanks advance,encryption aes diffie-hellman tls openssl,tls aes hellman encryption openssl diffie
262,private keys multiple devices,architecture user multiple devices phones needs broadcast payload devices channel devices listen receive payload need encryption messages devices phone create private/public key server use public key send encrypted messages solve problem devices mechanism private/public wrong appropriate case user ssh devices exchange data ... encryption protocol chosen believe appropriate case let know,rsa aes keys,keys aes rsa
263,integrity compromised hash modified,aware hashing user verify integrity cryptography query hashing suppose man middle attacker manipulates data creates new hash running manipulated data using hashing algorithm becausehashing algorithms universal algorithms send manipulated data receiver.when receiver runs manipulated data gets hash hash created attacker integrity verified actual data manipulated/modified integrity compromised possible possible eliminate problem solution regards ac,hash sha-256 sha-1 md5 integrity,sha hash integrity md5
264,length field sha-512 padding,using sha-512 message determine padding field length field determine length field think padding length field instance 1919-bit message padding field zero length field,padding sha-2 sha-512,padding sha
265,crypto usb devices pin/password stored,looking security cryto usb drives storing x509 certificates possession read/written using microsoft crypto apis reads/writes device prompts pin changed using ui installs device wondering stored/used device store pin device pin used generate symmetric encryption key used encrypt contents device right pin allow read device pin available device wondering standard way device vendors pkcs standard says device tamper-proof environment protected memory store private sensitive objects device encrypt objects master key derived user’s pin particular mechanism protecting private objects left device implementation clear tamper-proof environment protected memory case usb crypto device,passwords pki,pki passwords
266,twofish key length,using twofish say bit key difference using bit bit keylength bit significant digits key allo zero cases keylen parameter matter,twofish,twofish
267,safe md5 digest,heard md5 broken possible engineer collisions use say sha256 problem sha256 digests come function mdsha input return md5 sha256 input retain md5 digest lengths malicious collisions scheme sound,hash collision-resistance sha-256 md5,collision md5 hash resistance sha
268,simple xor secret key using dhe secure,client server given generator bit prime time clients hardcoded generate private exponent send result generate secure key done insecure channel simple diffie-hellman exchange step sent packet encrypted simple xor block cipher secure key bytes case long block way encryption secure much ways simple use much resources,encryption block-cipher diffie-hellman xor,xor encryption cipher diffie hellman block
269,encrypting passwords,using android keystore generate key protected fingerprint authentication key used encrypt secrets case want encrypt user password needed access app contents strong letter-number-special-characters password. encrypted password stored app preferences preferences public consider secure storage assuming attacker access encrypted password like little possible password thing comes password length length encrypted text seen password characters hide appending random text fixed length text passwords n characters n high serious issues best practice encrypt user passwords,encryption passwords,encryption passwords
270,proper formatting symmetric algorithm secret key,given description rfc sec value formulas derived session key follows first session key prefixed one-octet algorithm identifier specifies symmetric encryption algorithm used encrypt following encrypted data packet two-octet checksum appended equal sum preceding session key octets including algorithm identifier modulo value encoded described pkcs block encoding eme-pkcs1-v1_5 section rfc3447 form value used formulas see section document notes openpgp’s use pkcs guess pronoun passage means proper way format description seems vague everything goes eme-pkcs1-v1_5-encode input k length octets key modulus message encoded octet string length mlen mlen k output em encoded message octet string length k error message length checking mlen k output message stop generate octet string ps length k mlen consisting generated nonzero octets length ps least octets concatenate ps message padding form encoded message em length k octets em || || ps || || m. output given data elgamal modulus p bits octets symmetric key algorithm aes128 secret key checksum thought random_non_zero_data try decrypt data using real pgp program says key checksum failed get contradictory data pgpdump sym alg byte checksum bytes pkcs-1 block type tried random_non_zero_data didnt work exception decrypting secret key correct getting,implementation pgp,implementation pgp
271,sha1 hash functions contain quotes,feel foolish asking hash generated sha-1 encryption methods possibility containing quote characters escaped attempting make non-mysql database hold values hashes aware secure option holding things passwords private endevour fun planning store tables data json files need know need escape characters storing data,hash sha-1,sha hash
272,possible pick ed25519 public key,possible generate ed25519 keypair similar public key keypair fooling casual visual comparison hard solving sha-512 discrete logarithm problem,public-key signature ed25519,ed25519 public key signature
273,format preserving encryption suitable use words names,possible use fpe encrypt names language words order preserve length format keeping characters certain range a-z a-z way think moment reduce character decimal value encrypt seem secure character map value time,format-preserving,preserving format
274,looking cryptographic secure hash algorithm produces identical root hash sliced hash list,scenario similar described wikipedia hash list twist looking secure hash function create root hash file matter file chopped individual hashes list e.g case file divided parts hash list consists hashes parts root-hash computed hashes case file divided parts hash list consists hashes computed parts root hash computed hashes file want root hash doable restrictions number size file parts edit specific use case system stores files users large files sent stored smaller chunks control way files split chunks chunk encrypted beforehand client accompanied hash unencrypted content like know users upload file allows optimization know content file compute hash whole file using individual chunk hashes achieve,hash convergent-encryption,encryption hash convergent
275,real-world e-voting systems use paillier cryptosystem,lot theories paillier cryptosystem references e-voting real-world e-voting systems use paillier cryptosystem,reference-request paillier voting,paillier voting request reference
276,explanation parameters used ecc,difficult time finding clear explanation parameters used elliptic curve cryptography know certain p number order given field particular curve uses know k used secret key q= q_x q_y public key playing pages seeing contents file letft confused importance p differ q b change depending key question held constant curve function n seems less value p g order curve seed fit number encrypted done multiplying q extract coordinates q compact form used certficates,elliptic-curves,curves elliptic
277,many bits plaintext required verify stream cipher key,stream cipher n -bit internal state many bits known required confirm particular key key believe least n -bit plaintext reasoning n -bit state allow generate different key-streams assuming perfect bijection first n -bits correct,stream-cipher known-plaintext-attack,known plaintext attack cipher stream
278,analysis dghv security,want know security dghv breached using oracle binary gcd study paper homomorphic encryption integers able understand section theorem fix parameters ρ ρ′ η γ τ homomorphic scheme section polynomial security parameter λ attack advantage ε encryption scheme converted algorithm b solving ρ η γ -approximate-gcd success probability least ε/2 running time b polynomial running time λ understand subroutine learn-lsb z pk binary gcd following,encryption homomorphic-encryption,encryption homomorphic
279,block cipher algorithms variable block lengths,rijndael supports block lengths aes rijndael algorithms support variable block lengths rijndael unique regard,block-cipher symmetric blocksize,symmetric blocksize cipher block
280,cryptographic operations implemented using montgomery method,need implement cryptographic operations starting curve nistp256 told implement using montgomery method read pfd http //saluc.engr.uconn.edu/refs/sidechannel/okeya00elliptic.pdf states order curve divisible curve order multiple mean curve implemented using montgomery method ways implement,elliptic-curves,curves elliptic
281,ecdsa compressed public key point uncompressed public key point,ecdh demo generate private key alice get p gives following public key point x ecdsa public key compression coordinates prepended x coordinate used compressed key based x9.62 compressed key given derive i.e uncompressed point,elliptic-curves dsa,curves elliptic dsa
282,dh key exchange end authenticated,know man middle vulnerability unauthenticated dh key establishment way negate use authenticate keys used verify signature end vulnerability edit clear referring fact authenticated party know talking thinking cryptographic vulnerability someone control machine unauthenticated end damage,diffie-hellman authentication key-exchange man-in-the-middle,hellman exchange middle authentication key diffie man
283,difference linear cryptanalysis differential cryptanalysis,main difference linear cryptanalysis differential cryptanalysis example relation des,des differential-analysis linear-cryptanalysis,cryptanalysis des linear analysis differential
284,storage private keys,building bitcoin web application require users assigned wallet adding funds account plan exposing public key user bitcoin address users use exchange bitcoin client send money address accounts credited wondering best method storage wallet private key web application needs know user wants spend coins event database breach attacker steal everyone private keys therefore money idea like feedback secure using phpass utilizes bcrypt salt hash password signup signup occurs generate bitcoin key pair mcrypt_rijndael_256 encode private key using user password encryption key users willing spend coins re-ask password uncover private key web application small price pay added security database breached attacker see bcrypted passwords mcrypt_rijndael_256 encoded private keys know decryption key update suppose public key follow private key database attacker replace public key unbeknownst user way asked question bitcoin beta less emphasis specifics general best practice question,elliptic-curves dsa bcrypt rijndael secure-storage,secure rijndael storage curves elliptic bcrypt dsa
285,trying understand mixcolumns hexadecimal matrix,trying read understand textbook exercise questions sample solution end textbook final answer clarify got result trying question successful help appreciated questions show value state mixcolumns \begin d7\\f2 fe c5\\ab bmatrix answer final answer textbook \begin bmatrix b2\\55 e6 b8 bmatrix answer used path mentioned \begin bmatrix bmatrix \times \begin \\ f2 \\ \\ ab\end bmatrix \begin bmatrix \\ \\ \\ \end bmatrix f2 f2 f2 ab -- -- -- -- -- -- -- -- -- -- -- find value cell f2 xor ab -- -- -- -- -- -- -- -- equal,aes,aes
286,time pad considered chosen-plaintext attack secure,considering chosen-plaintext attack setting adversary access encryption oracle know considered secure use key ensure adversary uses key matter adversary uses encryption oracle end presented ciphertext corresponding plaintext queried adversary able decrypt know key making cpa-secure second train thought correct way think cpa setting thank,encryption cryptanalysis one-time-pad chosen-plaintext-attack decryption-oracle,decryption chosen encryption cryptanalysis plaintext attack pad time oracle
287,elgamal homomorphic encryption formula question,pubic key g q g h g group q prime g generator g thinking \mathrm enc r g^r h^r \cdot g^m,homomorphic-encryption elgamal-encryption,elgamal encryption homomorphic
288,file encryption authentication large files,cloud storage upload client want encrypt files read cloud service provider anyone gains access account like use standard format rolling crypto find anything want main problem want split large files parallel maximize bandwidth uploading part fails go upload part need encryption scheme allows encrypting parts file full authentication pass uploading avoided lot reading days came following scheme split file fixed sized kb blocks calculate sha-1 hash individual block append plaintext encrypt plaintext following hash using aes cbc mode random iv block similar rfc specifies symmetric encryption blocks provides authentication individual block protect file whole additional last block concatenation block hashes processed using technique rfc document clear provides modest security modifications thinking improvements use simple hash function replaced hmac document clear authenticate-then-encrypt secure cbc mode apply like keep authenticate-then-encrypt allows easy checking encryption key decrypting whole file happy last block repeats previous hashes hmac previous hashes suffice hope someone shed light practical security technique stumbled gcm seems want understand limit ~68gb encrypted given iv/key pair safe approach limit stay find good python library allows parallel encryption using gcm,aes hmac cbc gcm,cbc aes gcm hmac
289,elgamal cramer-shoup encryption given private key ciphertext public key determined,potential use case elgamal cramer-shoup encryption reverse visibility public private keys ciphertext private key published public key kept private data encrypted signed public key determined ciphertext private key known please demonstrate math,elgamal-encryption cramer-shoup,encryption cramer elgamal shoup
290,primes used generate rsa keys,confused keys rsa asymmetric encryption generated implications open communications textbooks say one-way function primes critical constraints -- primes generated get turned keys mean public key primes translated equivalent form example encrypt message someone public key one-way function broken third party decrypt message key generated prime prime go special process become key go encrypted message posted public forum sniffed wireless network etc one-way function mysterious third party mean message decrypted third party matter prime used wondering process whereby primes one-way function converted keys process regardless encryption used,rsa public-key prime-numbers,prime numbers rsa key public
291,cpa-security pseudorandom permutation encryption scheme,let f pseudorandom permutation define fixed-length encryption scheme gen enc dec follows input \in n/2 key k \in ^n algorithm enc chooses random string r \leftarrow n/2 length n/2 computes c f_k r||m show decrypt prove scheme cpa-secure messages length n/2 see decryption f_k^ -1 c r||m \rightarrow r_0r_1 ... r_ n/2-1 m_0m_1 ... m_ n/2-1 assuming n receiver knows extract first exact half right left ciphertext sequence cpa-security notice f_k deterministic r message ciphertexts c f_k r||m c f_k r'||m different r \neq r let q n polynomial number oracle queries r r probability \frac q n/2 negligible correct say something security parameter n feel missing something,provable-security chosen-plaintext-attack pseudo-random-permutation,chosen random pseudo plaintext attack permutation provable security
292,browser show user access website present certificate domain top level domain,example user tries access a.example.com server presents abc.example.com a.example.com sans list warning error,tls openssl certificates certificateless-crypto,tls certificates openssl crypto certificateless
293,crypto libraries/programs confidence,begun studying crypto thing learned implement crypto look using existing software libraries go implement something needs data security many options -- openssl mcrypt truecrypt crypt pycrypto bouncycastle ... know tried true regard crypto community scrutiny depends application implementation language data encryption generic answers common scenarios basic single-file encryption full disk encryption encrypted network communication audit source code naive say catch obvious vulnerabilities truecrypt high profile piece crypto software widespread calls public audit crypto software audited seems crypto software high confidence many eyes scrutinizing truecrypt openssl course usual disclaimer understand know vulnerabilities time nothing secure leaves high confidence low confidence measurement worth list high-confidence crypto libraries/software confidence well-defined list time-tested crypto libraries/software,encryption implementation file-encryption openssl,implementation encryption openssl file
294,best attack hfe cryptosystem,looking best know attack hfe cryptosystem reading paper degree regularity hfe found next claim joux demonstrated solve break systems case q small using grobner basis algorithm f4 experimental results imply algorithms finish degree order log_q highest degree polynomials need process degree order log_q conclude complexity algorithm n^ log_q using first hfe challenge i.e n q=2^n replace formula get log_ thinking make mistake replacing values hfe challenge interpreting wrong claim please help,post-quantum-cryptography,quantum post cryptography
295,constant-time comparison work,libsodium method comparing byte sequences constant time idea avoid early-out difference data detected heard thing imagined operating-system sleep operation round-up runtime algorithm threshold sounds inefficient,side-channel-attack libsodium,libsodium attack side channel
296,best hash nobody knows,confused companys use common hashes formulating password storage hash nobody knows solved hashing need know hash cbc undo hash keep secret thank,hash,hash
297,ciphertext size cpa-secure public-key encryption scheme,know cpa-secure public-key encryption scheme size ciphertext encrypting single bit superlogarithmic security parameter pk sk \leftarrow gen hold |enc_ pk b w \log n b \leftarrow problem took heuristic know big show,public-key chosen-plaintext-attack,chosen plaintext attack public key
298,kryptos k2 origin “abscissa” keyword,studying kryptos sculpture cryptographic puzzles k1 k4 similar palimsest keyword k1 keyword abscissa k2 determined brute-force better understand puzzle whole solve k4 important understand agent field discovered keywords suggestion keyword abscissa derived plaintext k1 reads subtle shading absence light lies nuance iqlusion given sort cryptic crossword reading give subtle shading ssa ... absence abs ... light speed light == c physics c ... lies nuance iqlusion standard sort anagram fun comes strong believable better theory,brute-force-attack,attack force brute
299,rsa encryption exponent,rsa public-key material e n encryption exponent e prime \phi n public key encryption algorithm resist cpa,rsa,rsa
300,ssl traffic inspection,decrypted session error certificate trusted certificate changed firewall cyberoam certificate public key got main public key cyberoam public key ssl traffic inspection authenticated encryption gcm,encryption tls,tls encryption
301,much weaker aes-64 aes-128,hard say exact qc specs let assume decent quantum computer using grover algorithm able half aes-128 keyspace aes-64 long bruteforce attack take aes-64 protected key aes-128 aes-256 able increase aes-512 maintain level security keyspace halved introduce possible vulnerabilities attack vectors addition attacks done qc,encryption aes cryptanalysis,encryption aes cryptanalysis
302,following rsa prng secure,requirement states generator withstand next-bit test consider following prng calculate next output x_i formula x_i x_ i-1 e\mod n see prng withstands state compromise extensions guess previous states given x_i e adversary compute future numbers generator considered secure,rsa pseudo-random-generator,random pseudo rsa generator
303,design secure key-dependent s-box,like design secure key-dependent s-box sure unsure difference design compared random s-box difference methods s-box construction “key-dependent s-boxes” “random s-boxes”,encryption algorithm-design s-boxes,encryption boxes design algorithm
304,multiply homomorphic encrypted value float number,know e homomorphic encryption multiply e integer b get e ab float number get e ab scheme support,homomorphic-encryption,encryption homomorphic
305,dsa require new k chosen restarted s=0,dsa algorithm used generate digital signature consists pair values r algorithm computes r first calculate s=0 says restart algorithm choosing different pseudorandom integer k starting point purpose digital signature r invalid s=0,dsa,dsa
306,encrypting big numbers small ones,new cryptography trying figure equation convert big number smaller reverse operation get big number problem equation use works fine numbers others want works encrypted data key data encrypted key course want difficult help,encryption,encryption
307,rsa ecdsa certificate sizes,table official sources compares size x509 certificates generated rsa starting bits ecdsa starting bits thanks support,rsa elliptic-curves reference-request certificates,reference request rsa curves elliptic certificates
308,ntru test vectors,find ntru test vectors research work stated test vectors available time esss1v2 standard ieee1363 appendix b mentions test vectors added future versions found get test vectors ntru,reference-request ntru test-vectors,test ntru vectors request reference
309,boneh/franklin identity based encryption tate pairing,boneh/franklin developed identity based encryption scheme based pairing algorithm standardised ieee p1363.3 know algorithm implemented type tate pairing find paper standard described anyone know good reference kind standard ieee iso ansi etc,elliptic-curves pairings identity-based-encryption,based encryption curves elliptic identity pairings
310,unsafe share parts password,best way ask question concrete answer set specific example example interested reading consider friend alice several ~5 hard drives encrypted truecrypt alice using aes 256-bit rounds ripemd-160 see script mounting different drives -i guess lazy wants type password course disk salted etcetera script figure password drive comes concatenating common string drives fixed string set script different drive know length common string user typed fixed strings 6-10 characters long let assume know common part password know fixed part disk see script question afraid diving explaining mathematical reason- insecure fact uses common string attack flaw know fixed part hard drive knew begin common part value unknown,aes ripemd,aes ripemd
311,strength md5 finding duplicate files,lot duplicate file finder applications using md5 algorithm strength md5 terms searching duplicate files hard disk flash driver storage device,hash md5,hash md5
312,total effective key length aesx-192,aesx-192 block cipher similar desx des replaced aes aes key size bits compute total effective key length aesx-192,aes des desx,aes des desx
313,convert projective jacobian co-ordinate ecc,small project using elliptic curve cryptography doubt convert projective jacobian coordinate system using affine conversion elliptic curve cryptography stuck point…,elliptic-curves,curves elliptic
