,title,content,complete_tags,words_in_tags
353,determine iteration times using pollard rho method factoring,let say large number n=181937053 f x =x^2+1 know problem using pollard rho method find algorithm iteration times need factor number x_0 y_0,random-number-generator factorization,random number generator factorization
354,store combination multiple pass phrases,let assume phrases real password user generated real password impossible guess need authenticate user best theoretical way store encrypt attacker somehow gets encrypted pass phrase able decrypt phrases know brute force attacker break encryption best make easier attacker break encrypt symmetric algorithm store matter first phrase vulnerable dictionary attack combine example p1f1p2f2… phrase1=p1p2p3… phrase2=f1f2f3… encrypt way combined phrase vulnerable dictionary attack attacker use brute force sure way combine affects encryption algorithm specific encryption algorithm better vulnerabilities regarding combine get discovered analyse many examples encrypted combined pass phrases guessing way know analysing algorithm encryption algorithm encrypted pass phrases,encryption passwords,encryption passwords
355,relations rsa dlog factoring dlog,definition generalized diffie-hellman problem let large primes p given x x^a x^b n find x^ ab \pmod known reduction gdh problem rsa problem i.e finding m^e\pmod n known reduction gdh problem integer factorization given solves second problem mentioned find efficient algorithm solves gdh problem side-notes course reduction gdh dlog know reduction dlog integer factorization rsa problem known rsa problem limited e=2 i.e finding square roots modulo p reduced integer factorization non-interesting case general e afaik reduction known interested hear dh gdh dh problem gdh prime p semiprime n,rsa public-key diffie-hellman discrete-logarithm factorization,logarithm hellman rsa factorization discrete key diffie public
356,encrypt network adapter mac address get cipher text length,character network adapter mac address get result cipher text length,encryption,encryption
357,publish accumulator trapdoor keep secure,implementing camenish-lysyanskaya dynamic accumulator seems accumulator secure trapdoor unknown attacker risks fact given euler theorem forge element accumulated passes test v^x\equiv v^ x\mod\phi \mod v accumulator x \phi euler function x\mod\phi\equiv x_f forged x passes test care factorization publish \phi require acceptable integer x_ acc x_ acc a+\phi \phi means example input string user1 string hashed accepted interval \phi large defy collisions stop caring keeping \phi secret forged inputs fall specified interval discarded words valid integer congruent integer maps input user1 think feasible missing something obvious understand skipped something important field please ask clarifications,modular-arithmetic accumulators,modular arithmetic accumulators
358,challenge use challenge-response proof-of-work,order guard denial-of-service attacks want require clients work work fulfilling request talking client connects server sends challenge including piece data find bytes x hash challengedata x n beginning client finds x sends server verifies hash challengedata recv n zeros beginning actual request handled found different methods generate challengedata thing problems random bytes client exhaust server prng connecting brings square denial service current time day seems good idea know attacks string involving something dependent particular request hashcash order make sure evil connections dropped possible avoid handing anything request making sure client done work idea client much work server starts handling request constraints server stateless want save hashcash make sure spent want challenge client work pre-computed want know anything request stage authentication server sends recieves little data possible instance current time nanosecond millisecond precision depending hardware implementation bytes double 2^64-1 tries i.e 8-byte response enough resetting connection foreseeable future short properties challenge need generated data properties current time good usual ask something protocol-design reinventing wheel existing protocols know,protocol-design challenge-response proof-of-work,protocol challenge work design response proof
359,using hashed password shared secrets good bad idea,built system allowed users generate unlimited number email addresses storing db created addresses made address hmac signed message shared secret bcrypt hashed version account password e.g example.com security critical worked considering using strategy something little delicate question ... using hashed password shared secret good idea bad idea,hmac secret-sharing bcrypt,secret sharing bcrypt hmac
360,perform computation encrypted data,code performs symmetric encryption using aes algorithm go performing computation achieve homomorphic encryption import android.net.uri import android.os.bundle import android.support.v7.app.appcompatactivity import android.util.base64 import android.widget.textview import com.google.android.gms.appindexing.action import com.google.android.gms.appindexing.appindex import com.google.android.gms.common.api.googleapiclient import java.security.key import java.security.securerandom import javax.crypto.cipher //import javax.crypto.keygenerator import javax.crypto.spec.secretkeyspec public class mainactivity extends appcompatactivity private static key key private static string encryptationmode aes private static byte keyvalue new byte /** attention auto-generated implement app indexing api see https //g.co/appindexing/androidstudio information */ private googleapiclient client /** attention auto-generated implement app indexing api see https //g.co/appindexing/androidstudio information */ private googleapiclient client2 protected void oncreate bundle savedinstancestate super.oncreate savedinstancestate setcontentview r.layout.activity_main // original text string thetesttext test textview tvorig textview findviewbyid r.id.tvorig tvorig.settext \n original \n thetesttext \n // set secret key spec 128-bit aes encryption decryption secretkeyspec sks null try //securerandom sr securerandom.getinstance sha1prng //sr.setseed data used random seed .getbytes // keygenerator kg keygenerator.getinstance aes mainactivity.key generatekey // key.init sr //sks new secretkeyspec key.generatekey .getencoded aes catch exception e //log.e tag aes secret key spec error // encode original data byte encodedbytes null try cipher c cipher.getinstance encryptationmode c.init cipher.encrypt_mode key encodedbytes c.dofinal thetesttext.getbytes catch exception e //log.e tag aes encryption error textview tvencoded textview findviewbyid r.id.tvencoded tvencoded.settext encoded \n base64.encodetostring encodedbytes base64.default \n // decode encoded data aes byte decodedbytes null try cipher c cipher.getinstance encryptationmode c.init cipher.decrypt_mode key decodedbytes c.dofinal encodedbytes catch exception e //log.e tag aes decryption error textview tvdecoded textview findviewbyid r.id.tvdecoded tvdecoded.settext decoded new string decodedbytes \n // attention auto-generated implement app indexing api // see https //g.co/appindexing/androidstudio information client2 new googleapiclient.builder .addapi appindex.api .build private key generatekey key key new secretkeyspec keyvalue encryptationmode return key,aes homomorphic-encryption java,encryption aes homomorphic java
361,calculating n-gram lists spaces ciphertext,analysis block ciphertext message characters including spaces .now spaces need taken account performing digram trigram analysis space occurred character ciphertext take space account digram analysis come many single words,cryptanalysis,cryptanalysis
362,proper usage gcm nonce tls1.2,written program help bouncy castle c library monitoring traffic send client server found something find strange client sends application data using following ciphersuite tls_psk_with_aes_128_gcm_sha256 gcm nonce starts server sends data client sends data server sends nonce etc correct twice server respond,tls gcm nonce,tls nonce gcm
363,many:1 collision md5,reference answer stackoverflow read first paragraph answer find line many:1 mapping meaning collisions function produces smaller output capable inputting feed possible file md5 get ton collisions many:1 collisions many:1 mean different inputs hash outputs,hash collision-resistance md5 terminology,collision hash resistance terminology md5
364,possible run public-key servers storage sending countless valid public-keys,public-key servers accept valid public-keys refuse accept massive keys single ip zombies hacked qualified key server sync requests generating kinds public key quick i.e. ed25519 high-speed high-security signatures specifies fast signing software takes cycles sign message westmere signs messages second fast key generation key generation signing slight penalty key generation obtain secure random number operating system /dev/urandom linux costs cycles possible attack key servers massive valid frivolous public-keys continue work go offline refuse accept new public keys ban certain kinds key generating algorithms delete keys uploaded certain time requires registration captcha public-key server system designed kind attack edit werner koch submitted i-d use ed25519 openpgp idea accepted openpgp supported statistics https //sks-keyservers.net/status/key_development.php says openpgp keys total sources claims keys added daily maximum exception thousand day generating ed25519 public keys easy amount public keys small expected trillions amount pega-bytes occupy double keys day joke servers discard keys avoid garbage good keys wonder case negative amount keys added statistic means good keys discarded distributed attack time idea conclusion applies ecc curves idea rsa generating weak keys matter easy break wonder pgp servers survived juvenile field,rsa public-key key-exchange pgp ed25519,key exchange rsa pgp ed25519 public
365,creating custom way encryption class,trying make simple way encryption function uses substitute cipher encryption inverse substitution decryption want move substitution algorithm question follows things need look creating custom encrypt/decrypt algorithm link question code,encryption substitution-cipher,encryption cipher substitution
366,exchange shared key hardness assumptions,imagine p=np way functions exist people end shared key arbitrary length exchange public true rngs know talking worried mitm attacks someone sharing channel time pads people want get time pad third person check afterwards pad sending random bits seems way person send secure message third person shares otp send different layers added time unlayering afterwards see work solution make sides end key middle person way getting motivation cas act middlemen secure communication post-p=np world computer shipping cas otps,key-exchange authenticated-encryption one-time-pad,authenticated exchange encryption pad key time
367,performance checking image steganography technique,working image steganography lsb technique lossless compression performance measured psnr value higher psnr value greater performance standered input data size read paper mention performance mention data size suggestion size image working x extension .png pixel rgb color hiding bit data,steganography,steganography
368,build difference distribution table,studying differential cryptanalysis found metric measure resistance sbox use necessary build difference distribution table link table sobox s1 des build table aes sbox example,s-boxes differential-analysis,boxes differential analysis
369,calculate many trials need guess plain text simple p-box used make cipher text,bit input box use transposition process plain text given bits contains bits many trial,encryption cryptanalysis transposition-cipher,encryption transposition cipher cryptanalysis
370,unique decentralized id systems,familiar standard decentralized id system web trust e.g pgp keys normal web trust systems unable guarantee uniqueness — practical limit number public keys register aliases appear seperate individuals systems unsuited applications voting uniqueness paramount question id systems decentralized i.e trust single individual group time guarantee high probability given ids unique individuals,voting,voting
371,hmac-sha1 vs hmac-sha256,questions use hmac-sha1 hmac-sha256 message authentication much hmac-sha256 slower hmac-sha1 security improvements sha256 sha1 justify usage,hash hmac sha-256 sha-1 sha-2,sha hash hmac
372,different applications hash functions demand different properties hash function,strong cryptographic hash function general guarantee several properties including preimage resistance second preimage resistance collision resistance turns certain applications require subset properties others require table gives summary applications require properties stalling book someone give explanation properties required application example makes sense one-way passwords require preimage resistance want person compute password hash understand one-way passwords require collision resistance i.e. different passwords give hash impostor break anyone explanation different properties table authoritative textbook area stalling book,hash collision-resistance preimage-resistance 2nd-preimage-resistance password-hashing,hash resistance collision preimage password hashing
373,bad design reuse aes key,company work needs develop simple system client encrypt token transmitted client decryption performed server client transmits token machine performs crypto token external service integrity checking issue wrote code encrypts tokens using aes/cbc using key unique iv aware practical attacks aes large number known ciphertexts colleague insists break i.e get key decrypt stuff collecting large amount ciphertexts argues key client server correct,aes cbc key-reuse,cbc aes reuse key
374,reasonable length diffie-hellman safe prime,program uses following openssl function ... dh_generate_parameters null null ... create dh parameters later used hundreds key exchanges one-time keys used login details sent internet manual page says prime_len bits secure value bad feeling reading http //www.keylength.com/ correspond discrete logarithm key discrete logarithm group looking wrong place,diffie-hellman key-size,diffie hellman key size
375,dghv bootstrap recrypt cipherbit,implementing homomorphic crypto-system http //eprint.iacr.org/2011/440 using sage math get bootstrap done scheme appendix say apply decryption circuit expanded ciphertext z encrypted secret key bits σi thing understand decryption circuit requires modulo apply modulo cipherbit staying cipherworld using public key decrypt implementation using recrypt function understand,homomorphic-encryption,encryption homomorphic
376,implementing cbc encryption using decryption,implemented algorithm working end message backwards creates valid cbc ciphertext plaintext using block cipher decryption operation encryption operation bet described literature bad idea questions method/algorithm/construction called secure cbc implemented normal way normal rules cbc iv apply last ciphertext block wondering want encrypt message end exercise exploiting padding oracle attack dummy code running server,cbc modes-of-operation,cbc operation modes
377,understanding math rsa key derivation,reading key derivation rsa steps wiki select strong primes p q pq n \phi p-1 q-1 select e e \phi n coprime select ed mod \phi understand \phi n needed skip step say -- select e e n coprime work math somehow dependent e coprime \phi n clarify main question e needs prime phi n work prime n following poncho answer -- lets say want pick e prime n. example lets say edmod course e prime number spec say e prime appear \phi n chosen smaller n giving opportunity find e choose p-1 q-1 operation make result smaller n know missing something clicking hope explains,rsa,rsa
378,understanding elliptic curve encryption,hard time understanding elliptic curve encryption thing thing understand listing points curve mod p. suppose following elliptic curve y^2 x^3 \pmod find list points run x \leq solve know output following x solution mod x y^2 mod x y^2 mod x y^2 mod x y^2 mod points point infinity idea happening example x=1 solving becomes mod say x=1 trouble understanding point doubling using following algorithm compute \equiv -1 \pmod p new x x_3 m^2 x_1 x_2 \pmod p y_3 x_1 x_3 y_1 \pmod p seem work someone give example point doubling e.g following equation y^2 x^3 \pmod point p compute,elliptic-curves modular-arithmetic,modular curves elliptic arithmetic
379,time-space tradeoff attack breaking symmetrical cryptos,known techniques using time-space tradeoff speeding symmetrical crypto breaking kind rainbow tables speed breaking hashes using huge precomputed tables something similar possible symmetrical cryptos aes difference block stream ciphers regard get least head start brute forcing searching gigantic tables lot plaintext heads pre-computed,symmetric brute-force-attack,symmetric attack force brute
380,ecdsa public key generation,referring wikipedia page ecdsa-cert paper understand given \mathcal e \mathcal e b \mathbb f elliptic curve \mathbb f group g \in \mathcal e generator group i.e \exists n n\times g n order point g respect group choosen d_a\in n-1 private key q_a\triangleq n \times d_a public got key pair validation bob process see respect bounds q_a \neq trivial q_a \in \mathcal e trivial q_a\times understand last thing acquainted ec algebra comparing q_a\times n g seems thing conclude q_a=g false missing,elliptic-curves algorithm-design dsa,algorithm design curves elliptic dsa
381,public key private key exchangeable,get key pair rsa algorithm make private-key public keep public-key secret breaking security encryption signature,rsa public-key,rsa key public
382,constructs data-dependent swaps rotations cryptanalyzed,linear differential cryptanalysis seem suited constructs simple fixed structure boolean expressions ciphers incorporate swaps array elements indices swapped dependent dynamic cipher state others include rotations variable number bits case rc4 entire cipher state embodied permutation fixed set integers seem induce combinatorial explosion number expressions needed track bias system good thing side-channel challenges constructs stronger made fixed structures harder analyze math used attack/analyze,cryptanalysis rc4,rc4 cryptanalysis
383,prove hardness approximate-gcd problem,trying prove security system using hardness assumption approximate-gcd problem using contradiction i.e attacker able break scheme attacker able solve approximate-gcd problem stuck point proved complexity using brute-force approach proceed concrete complexity measure used contradiction,homomorphic-encryption provable-security semantic-security hardness-assumptions,semantic encryption homomorphic assumptions provable security hardness
384,key check value standard practice asymmetric cryptography,looking standard sound industry practice equivalent key check value applied private key public key algorithm ecdsa des keys practice worded e.g card personalization specification key check value purpose data used prove card/processor access specific des key value format binary bytes contents leftmost bytes result encrypting bytes zeros des key concerned notice definition wrong kcv defined anything knowledge kcv actual purpose interested guard wrong value key accidental deliberate participant scheme key rebuilt shared secrets simplicity assume xor components least participant cheat,public-key keys,keys public key
385,kryptos k1 origin palimpsest keyword,studying kryptos sculpture cryptographic puzzles k1 k4 understand keyword reverse-engineered using tableau brute-force computer processing sanborn said sections solved using pencil paper theories morse come good explanation tease palimpsest frustrated trying find kryptos yahoo group,brute-force-attack classical-cipher vigenere,force classical brute attack cipher vigenere
386,translation hash french,french presentation basic cryptography generation random numbers terms translatable seem find word hash cryptographic hashing french closest come gâchis means mess failure,hash,hash
387,crypto libary commutative encryption,want implement mental poker javascript toy program lead larger serious project research found massey-omura cryptosystem shamir three-pass protocol find implementations information sra scant anyone able shed light implement commutative encryption sra rsa know massey-omura/shamir library,rsa commutative-encryption,encryption rsa commutative
388,srp-6 calculation b include multiplier k,srp-6 b calculated b=kv+ g^b k=3 purpose k fixed srp-6a value replaced k h n g question srp-6,protocol-design passwords srp,design srp passwords protocol
389,questions oaep rsa,questions oaep rsa number bits pad chosen example sending byte message rsa-2048 unused bits byte split remainder bits pad zeroes r random bits pick number bits pad matter hash functions g h e.g sha-256 variables reference ones diagram found wikipedia article “optimal asymmetric encryption padding” question proper technique expanding shrinking data using hash functions use hash seed secure prng generate n random bits wrong,rsa padding oaep,padding rsa oaep
390,mov attack work,mov work used explained briefly know used,cryptanalysis elliptic-curves,curves elliptic cryptanalysis
391,implement key size,curiosity implement key size please explain understand expert,aes,aes
392,elliptic curve cryptography used compared rsa,ran elliptic curve crypto-systems introduction theory elliptic curves brown university elliptic curve cryptography wikipedia performance analysis identity management session initiation protocol sip ieee overview elliptic curve cryptosystems rsa.com seemed great alternative rsa de-facto cryptosystems used banking financial systems public key infrastructure certificates used someone explain done helpful comparison traditional rsa elliptic curve cryptology helpful begin advantage rsa established advantages elliptic curve shorter keys strong key rsa see ieee paper low cpu consumption low memory usage,public-key rsa elliptic-curves,curves elliptic public key rsa
393,prp representation size,studying block cipher substitution-permutation network construction realized uses several small pseudo-random permutations big saving memory reasons prp input/output n bits utilize \log memory saving full table \mathrm domain \to\mathrm range thought utilize n\cdot2^n,encryption permutation,encryption permutation
394,store key system source visible,customer access database ugh credit cards stored plaintext yikes amongst changes app applying encryption used rijndael algorithm choice struggling find correct approach storing encryption/decryption key access database source-visible provide decent security prevent someone grabbing database local access machine internet connected feel omst way missing vital piece jigsaw,keys,keys
395,difference ibe abe schemes,somebody explain simple words real life example light help limitations schemes etc,identity-based-encryption abe,encryption based abe identity
396,rsa decryption samples,working project client involves decryption data encrypted using rsa system question retains independent copies data-set copy encrypted different key scenario private keys gone want know anyone knows methodology use encrypted copies data identical padding determine original data-set help/thoughts/comments appreciated,encryption rsa public-key,encryption rsa key public
397,regular ctr mode vulnerable attacks,regular plain ctr mode vulnerable attack plan write program encrypt drive ctr mode wise aes better look diagram looks pretty solid question broad allow rephrase better ctr mode picture encrypt drive,aes ctr,aes ctr
398,meet-in-the-middle attack,meet-in-the-middle attack algorithm literature say secure des,3des meet-in-the-middle-attack,meet attack middle
399,schnorr identication protocol,schnorr identification protocol said honest verifier knowledge protocol imply work wondering case mean honest prover denied authorization misbehaved verifier,schnorr-identification,identification schnorr
400,generating keys hkdf diffie hellman agreement,order generate multiple session keys diffie hellman key agreement protocol trying use hkdf generate session keys hkdf algorithm uses extraction-expand procedure extraction procedure takes input salt source key case diffie hellman generated key know salt random non-secret value question establish random salt value entities set value applying hash function diffie hellman key salt hashfunction diffiehellmankey,key-derivation salt hkdf,salt derivation key hkdf
401,execution time hmac-md5 bit data using bit key cpu,need know execution time hmac bit data using bit key ghz cpu specify parameters machine ram operating system used etc,hmac,hmac
